{
  "id": "d1e2f3a4b5c6d1e2f3a4b5c6d1e2f3a4b5c6d1e2f3a4b5c6d1e2f3a4b5c6d1e2",
  "script": "aW1wb3J0IEZ1bmdpYmxlVG9rZW4gZnJvbSAweDlhMDc2NmQ5M2I2NjA4YjcKCnRyYW5zYWN0aW9uKGFtb3VudDogVUZpeDY0LCByZWNpcGllbnQ6IEFkZHJlc3MpIHsKICBwcmVwYXJlKHNpZ25lcjogQXV0aEFjY291bnQpIHsgfQp9",
  "arguments": [],
  "reference_block_id": "a1b2c3d4e5f6a1b2c3d4e5f6a1b2c3d4e5f6a1b2c3d4e5f6a1b2c3d4e5f6a1b2",
  "gas_limit": "9999",
  "payer": "f8d6e0586b0a20c7",
  "proposal_key": {
    "address": "f8d6e0586b0a20c7",
    "key_index": "0",
    "sequence_number": "42"
  },
  "authorizers": ["f8d6e0586b0a20c7"],
  "payload_signatures": [
    {
      "address": "f8d6e0586b0a20c7",
      "key_index": "0",
      "signature": "cGF5bG9hZHNpZ25hdHVyZQ=="
    }
  ],
  "envelope_signatures": [
    {
      "address": "f8d6e0586b0a20c7",
      "key_index": "0",
      "signature": "ZW52ZWxvcGVzaWduYXR1cmU="
    }
  ],
  "result": {
    "block_id": "a1b2c3d4e5f6a1b2c3d4e5f6a1b2c3d4e5f6a1b2c3d4e5f6a1b2c3d4e5f6a1b2",
    "collection_id": "b1c2d3e4f5a6b1c2d3e4f5a6b1c2d3e4f5a6b1c2d3e4f5a6b1c2d3e4f5a6b1c2",
    "execution": "Success",
    "status": "Sealed",
    "status_code": 0,
    "error_message": "",
    "computation_used": "7",
    "events": [
      {
        "type": "A.1654653399040a61.FlowToken.TokensWithdrawn",
        "transaction_id": "d1e2f3a4b5c6d1e2f3a4b5c6d1e2f3a4b5c6d1e2f3a4b5c6d1e2f3a4b5c6d1e2",
        "transaction_index": "0",
        "event_index": "0",
        "payload": "eyJ0eXBlIjoiRXZlbnQiLCJ2YWx1ZSI6eyJpZCI6IkEuMTY1NDY1MzM5OTA0MGE2MS5GbG93VG9rZW4uVG9rZW5zV2l0aGRyYXduIiwiZmllbGRzIjpbeyJuYW1lIjoiYW1vdW50IiwidmFsdWUiOnsidHlwZSI6IlVGaXg2NCIsInZhbHVlIjoiMTAuMDAwMDAwMDAifX0seyJuYW1lIjoiZnJvbSIsInZhbHVlIjp7InR5cGUiOiJPcHRpb25hbCIsInZhbHVlIjp7InR5cGUiOiJBZGRyZXNzIiwidmFsdWUiOiIweGY4ZDZlMDU4NmIwYTIwYzcifX19XX19"
      }
    ]
  },
  "_expandable": {
    "result": "/v1/transaction_results/d1e2f3a4b5c6d1e2f3a4b5c6d1e2f3a4b5c6d1e2f3a4b5c6d1e2f3a4b5c6d1e2"
  },
  "_links": {
    "_self": "/v1/transactions/d1e2f3a4b5c6d1e2f3a4b5c6d1e2f3a4b5c6d1e2f3a4b5c6d1e2f3a4b5c6d1e2"
  }
}
